{
  "$schema": "https://json-schema.org/draft/2020-12/schema",
  "$id": "https://example.invalid/schemas/new-project.intent/v3",
  "title": "Ticket intent",
  "type": "object",
  "additionalProperties": false,
  "required": ["schema", "ticketId", "title", "status", "purpose", "allowedPaths", "forbiddenEffects", "validation"],
  "properties": {
    "$schema": { "type": "string" },
    "schema": { "const": "new-project.intent/v3" },
    "ticketId": { "type": "string", "pattern": "^ticket-[0-9]{3}$" },
    "title": { "type": "string", "minLength": 1 },
    "status": { "enum": ["planned", "in_progress", "blocked", "done"] },
    "workstream": { "type": "string" },
    "purpose": { "type": "string", "minLength": 1 },
    "scope": { "type": "array", "items": { "type": "string", "minLength": 1 } },
    "allowedPaths": { "type": "array", "minItems": 1, "items": { "type": "string", "minLength": 1 } },
    "forbiddenEffects": { "type": "array", "minItems": 1, "items": { "type": "string", "minLength": 1 } },
    "dependencies": { "type": "array", "items": { "type": "string" } },
    "validation": { "type": "array", "minItems": 1, "items": { "type": "string", "minLength": 1 } },
    "acceptanceCriteria": { "type": "array", "items": { "type": "string", "minLength": 1 } },
    "evidencePolicy": {
      "type": "object",
      "additionalProperties": false,
      "required": ["humanIntentHome", "projectRealityHome", "llmAuthority", "unknownIsFalse"],
      "properties": {
        "humanIntentHome": { "type": "string", "minLength": 1 },
        "projectRealityHome": { "type": "string", "minLength": 1 },
        "llmAuthority": { "const": "propose-only" },
        "unknownIsFalse": { "const": false }
      }
    }
  }
}
